[
  {
    "quest_id": "quest_first_service_halls_recovery",
    "display_name": "First Service Halls Recovery",
    "giver_npc_id": "npc_tom_quartermaster_v0",
    "objectives": [
      {
        "objective_type": "ExtractWithItem",
        "item_id": "consumable_almond_water",
        "quantity": 1
      },
      {
        "objective_type": "ExtractWithItem",
        "item_id": "item_scrap_metal",
        "quantity": 3
      }
    ],
    "rewards": [
      {
        "item_id": "currency_old_movie_ticket",
        "quantity": 20
      }
    ],
    "description": "Recover enough supplies from Level 1 to prove the first extraction loop."
  }
]
